comment,compound,negative,neutral,positive,from_post_id
"Anybody remember when these Muslims overran places and raided government buildings for...(wait for it...)....blank passports AND passport machines? Wait until one of these sympathizers invites ""papa and mema"" over with their fake passports and then terrorize us. Who takes responsibility?",-0.17,0.17,0.83,0.0,10154890600247217
Was this judge elected by people of USA? I think it's just about time to reform the judicial law as well. Hopefully D.T got some tips from President of Poland,0.151,0.0,0.849,0.151,10154890600247217
Ironic that Trump being a granddad himself cannot fathom simple things.,-0.143,0.143,0.857,0.0,10154890600247217
"Congrats, you just earned another yourself another beat down from SCOTUS. You might as well assume the position when they hear it because your decision is you to be screwed. PRESIDENT Trump has done nothing wrong when it comes to the travel ban.",0.022999999999999993,0.129,0.719,0.152,10154890600247217
"The whole deal with the countries listed in the travel ban is that they are incapable or do not do due diligence in verifying a persons identity.
The other forty-something other Muslim countries that are not listed in the ban, do comply with international norms with regard to Passports and identity verification.",-0.17,0.17,0.83,0.0,10154890600247217
"this Travel Ban is funny, its already almost impossible for muslims to Get US visa, the only difference is True just say it all laud .. there is no fun difference.. #fakenews 
FYI: I am not trump suporter",0.119,0.12,0.641,0.239,10154890600247217
"You continue to undermine Trump, when those terrorist strike, I hope you will be happy with the verdict.",-0.007000000000000006,0.304,0.399,0.297,10154890600247217
"ime at a loss here , the usa is a independent country  ,or collection of , its there rules ,why are people so bothered about it ,all non westerners seem to want to do is come to the west and bomb , kill , use and abuse the benefits then moan , dont go ,its simple ,why should we live in shitholes and fear for our kids lives ?. hate us so much they want to live there ? ,two faced its called over here.",-0.21600000000000003,0.269,0.677,0.053,10154890600247217
"Finland welcomed 100 so called refugees from Somalia in the 90's . Today , with arrival of such close relatives , family reunification the population of Somalis in Finland is over 13 000 . Good luck USA. May God protect you.",0.289,0.0,0.711,0.289,10154890600247217
"Where do judges get off dictating law or homeland security. They are the judicial branch and the USA has 3 branches as separation of powers for a reason.  Stick in your lane lib judges 
It will just go to the supreme and be over ruled.  No blow, just like an annoying house fly.",0.060999999999999985,0.082,0.774,0.143,10154890600247217
"The entire ban is a farce to begin with, but let's look at how the Trump administration is trying to sidestep court rulings anyway. To give an example: apparently your brother would be allowed, but your brother's wife and son aren't (since he would be your nephew and she your sister in law and thus not allowed).

So he's already effectively prevented your brother from entering really anyway, even if Trump's administration hasn't explicitly prevented him from doing so. It's just disgusting and xenophobic all round :/",-0.057999999999999996,0.125,0.808,0.067,10154890600247217
"Grandparent are attacking US.
US. is unsafe, search their walkers, wheelchairs, and medications' containers😵😱😨",-0.188,0.188,0.812,0.0,10154890600247217
"So if a country normally proud of its fair checks and balances system is systematically having its judges rule against the travel ban, then guess what? Maybe it's illegal!",-0.05700000000000002,0.203,0.651,0.146,10154890600247217
Not really thi will get ruled down like all the other ones from the judges in Hawaii........,0.135,0.0,0.865,0.135,10154890600247217
Donnie is the greatest hoax ever perpetrated on the American people.,0.138,0.137,0.588,0.275,10154890600247217
"Trump gets small win from Supreme Court and overplays his hand by trying to turn it into a wider ban.   Guess this explains why he was  sued 3500 times in his businesses.  The law does apply to you, Donny!",0.15100000000000002,0.074,0.701,0.225,10154890600247217
"I find it difficult to believe some one would try to discourage people to visit Hawaii with this type of statement or ruling
,",-0.209,0.209,0.791,0.0,10154890600247217
"They can be. Anybody can be, it has much less to do with genetics than it does proximity and cordiality/accord. One of my grandparents was 2000 miles away and I saw her a couple times a decade. My other grandmother lived a few hours drive away most of my life, I wouldn't exactly say we were close. Same with all of my aunts, uncles and cousins.
I disagree with the band but I concur with the definition. As with almost everything it deserves and requires to be evaluated on an individual basis.",-0.021,0.021,0.979,0.0,10154890600247217
I know you all love everything Trump does because he is perfect and has no flaws like the rest of humanity but I really want a trump supporter to lie to me and tell me grandparents aren't close family. We all want to be safe. But I'm tired of America doing terrible things and using fear to justify it. So go ahead and tell me how you hate grandparents and how they aren't your family,-0.017000000000000015,0.197,0.623,0.18,10154890600247217
"When you apply permanent residency for your relatives, only parents and children of yours are considered. No grandparents, no uncles no nieces or nephews. And all immigrants to this country accepted it as a standard. If grandparents and in laws are included, then they must change the immigration laws.",-0.08499999999999999,0.125,0.835,0.04,10154890600247217
Are you guys idiots or is the first time you heared about first degree : children parents and brothers.  It is as it is and is everywhere in this world. Smash marxism everywhere ! Shut leftards forever. Bring back liberals.,0.0,0.0,1.0,0.0,10154890600247217
It's not even that over here i carnt take my mum or my sisters or any of my nephews and nices to see my little girl coz social don't class them as close family members,0.0,0.0,1.0,0.0,10154890600247217
That judge is going to get himself kicked off the bench.,0.0,0.0,1.0,0.0,10154890600247217
"Safety 1st🇺🇸

Don't wanna end up like England and France...oh and all of Europe. Leftist fools living in fear...while the government does NOTHING.",0.074,0.112,0.702,0.186,10154890600247217
So the same Obama judge who has been shut down several times for his partisan bs has tried it again?,0.0,0.0,1.0,0.0,10154890600247217
A judge does not have the authority to make laws or rewrite law. They can send it back to law makers but it was upheld at this point by the SCOUS. These liberals just don't get it.,-0.031,0.031,0.969,0.0,10154890600247217
Ironic because Hawaiians are fighting for Independence from America and dont want non-Hawaiians there. This is just virtue signalling by them.,-0.09699999999999999,0.209,0.679,0.112,10154890600247217
After reading some of the comments here I'm starting to wonder idf anyone actually read the story,0.0,0.0,1.0,0.0,10154890600247217
Uh. No. Close relative means immediate family. We learned this in school. English 1,-0.155,0.155,0.845,0.0,10154890600247217
seems like there are some good judges in hawaii,0.435,0.0,0.565,0.435,10154890600247217
Don't worry about keeping America safe from Muslims. Christians fill our prisons.,0.347,0.0,0.653,0.347,10154890600247217
Let the all go to Hawaii and stay with the judge and Obama family  :),0.176,0.0,0.824,0.176,10154890600247217
"And let me guess, without reading the article, the judge is from Hawaii.",0.0,0.0,1.0,0.0,10154890600247217
There is a plan to shunt all immigrants to Hawaii since they love them so much.,0.231,0.0,0.769,0.231,10154890600247217
"Why would grandparents not be allowed in the first place,after your parents,grandparents are the next closest from family",0.0,0.0,1.0,0.0,10154890600247217
"""Family"" was already defined by USCIS, and that definition does not include grandparents. Regardless of supporting or not supporting the ban, the definition of ""family,"" for immigration purposes, has been in place for a long time now. 

https://www.uscis.gov/family/family-us-citizens",0.204,0.0,0.796,0.204,10154890600247217
I'm a grandmother but not a family member? What am I then? This travel ban is crazy.,-0.411,0.411,0.589,0.0,10154890600247217
How it is they were never included in the first place is beyond rational logical thinking.,0.0,0.0,1.0,0.0,10154890600247217
Trump is doing his job! Don't hate pls!,0.21900000000000003,0.113,0.555,0.332,10154890600247217
Liberal judges throwing stuff at the wall to see if it will stick,0.0,0.0,1.0,0.0,10154890600247217
"if americans cant get rid of this orange maggot, he will run for re-election in 2020 and probably win.",0.174,0.0,0.826,0.174,10154890600247217
"Don't worry, Trump will just take it to the Supreme Court again. He won last time, he will probably win again.",0.443,0.0,0.557,0.443,10154890600247217
"Should define close relative as anyone on the same plane, and sink it completely.",0.0,0.0,1.0,0.0,10154890600247217
Only in Trump world would grandparents not be considered close family,0.0,0.0,1.0,0.0,10154890600247217
"Actually he shouldn't mind this one, it's how he staffed the White House.",0.0,0.0,1.0,0.0,10154890600247217
It is is time to rid the judiciary of that idiot.  He gives the system a black eye,-0.171,0.171,0.829,0.0,10154890600247217
Supreme Court is the highest office or not?! Hawai is just a jurisdiction! How can a simple judge overrule ?! Can somebody tell me ?,0.193,0.0,0.807,0.193,10154890600247217
People are mad at trump and they don't even know why when confronted and asked in person pmsl,-0.238,0.238,0.762,0.0,10154890600247217
It does say an awful lot about Trumps understanding of relationships,-0.231,0.231,0.769,0.0,10154890600247217
time as american people let president do his job  the last fool did let this fool too,-0.279,0.279,0.721,0.0,10154890600247217
Failed state countries that hate the US anyway... impossible to verify anyone from there.  There is no right to immigrate or even visit the US.,-0.295,0.295,0.705,0.0,10154890600247217
Trumo doesnt understand the concept. He has bought and sold love all his life,0.244,0.0,0.756,0.244,10154890600247217
That ugly old face..... why do you have to show it? Just put the #45 in its place.,-0.163,0.163,0.837,0.0,10154890600247217
Hmmm.... seems some people have forgotten this country was founded by illegals and terrorists.,-0.333,0.333,0.667,0.0,10154890600247217
Ok. Judge.. Make your state a sanctuary.  See how the citizens like it.  You probably won't be on the bench long.  👎.,0.198,0.0,0.802,0.198,10154890600247217
"Maybe not to Trump, his grandfather was a German Immigrant, and we know how much he hates immigrants",-0.153,0.153,0.847,0.0,10154890600247217
"Boy, this hawaiian judge sure is trying. Too bad the Supreme Court ruled in favor of the president.",0.196,0.134,0.536,0.33,10154890600247217
The BBC wants the USA be invaded just like Europe has been.,0.185,0.0,0.815,0.185,10154890600247217
Just ban those leftist suckers and that will be very fxxxxing enough.,-0.408,0.408,0.592,0.0,10154890600247217
Trump advisers and his administration are delusional set of people..,0.0,0.0,1.0,0.0,10154890600247217
Donald hated his grandfather. For he was a German immigrant named Drumpf.,-0.296,0.296,0.704,0.0,10154890600247217
Too bad the Bastille in Paris was torn down at the start of the French Revolution ...,-0.268,0.268,0.732,0.0,10154890600247217
"Grandparents are close family members, just do your DNA on ancestry, it says so.",0.0,0.0,1.0,0.0,10154890600247217
"Judges, a danger all over the world, never a good decision...",-0.453,0.453,0.547,0.0,10154890600247217
Judges aren't supposed to redefine a term based on their personal feelings. That just bad jurisprudence.,-0.2,0.2,0.8,0.0,10154890600247217
Wonder if Trump's grandparents r still alive today...,0.302,0.0,0.698,0.302,10154890600247217
ทรั้มป์..ระวังซิพสมอแม้ว..ไอ้หมากินความคุึดนะ..มันจะยุยงให้ซาวบ้านเผาประเทศ.นะทรั้มป์..,0.0,0.0,1.0,0.0,10154890600247217
W/O Grandparents there would be NO Parents. A jackassed ban...,-0.268,0.268,0.732,0.0,10154890600247217
"Meanwhile Yet ANOTHER RUSSIAN they forgot to mention...so MORE lies from Kushner and Trump....Just how long is the GOP going to look the other way while treasonous traorors sit in the White House and dismantle our government????? 
Conspiring with a hostile enemy state engaged in a cyberwar against the United States with the goal of undermining the votes of American citizens to halt the transfer of power and overthrow that legitimate government Americans voted for and instead install an illegitimate Russian puppet government in power IS THE EXACT DEFINITION OF TREASON. Period. #LockEntireTrumpAdministrationUp #Treason",-0.138,0.188,0.762,0.05,10154890600247217
hahahaha what he's looking up I think his pigeon has lost...,0.0,0.0,1.0,0.0,10154890600247217
I'd like to send a passing comment  that he's in a really bad shape. Looking like an orange pile of crap...,0.049000000000000016,0.153,0.645,0.202,10154890600247217
Better dont bring them in all else no longer america  because they want everything  but god is watching them they read the book to much .,0.14700000000000002,0.056,0.741,0.203,10154890600247217
"If even the judge don't unite behind trump, how to make america great again ??",0.242,0.0,0.758,0.242,10154890600247217
A stupid ban. My granparents are almost like part of our family.,-0.27899999999999997,0.407,0.465,0.128,10154890600247217
Trumpkins are lacking many brain cells.,0.0,0.0,1.0,0.0,10154890600247217
Well done that Judge.,0.412,0.0,0.588,0.412,10154890600247217
"America is the last safe country for westerners thanks to tolerant liberals. 

Let that sink in.",0.378,0.0,0.622,0.378,10154890600247217
Judge cannot overrule SCOTUS.,0.0,0.0,1.0,0.0,10154890600247217
Somebody should sack that Judge.,0.0,0.0,1.0,0.0,10154890600247217
"It baffles and terrified me...

The liberal west continue to fight so vigorously for our extinction.",-0.214,0.306,0.602,0.092,10154890600247217
Whether one is a distant relative or a close relative should be depended on mental distance between the two.😁,0.0,0.0,1.0,0.0,10154890600247217
Judges in Hawaii = obama's school chums,0.0,0.0,1.0,0.0,10154890600247217
How many refugees has Hawaii taken in? Zero,0.0,0.0,1.0,0.0,10154890600247217
😝,0.0,0.0,0.0,0.0,10154890600247217
Some judge in Hawaii? Lol,0.412,0.0,0.588,0.412,10154890600247217
Hawaii,0.0,0.0,1.0,0.0,10154890600247217
I'm glad check and balance still works.,0.333,0.0,0.667,0.333,10154890600247217
It means tourist visa can be apply..,0.0,0.0,1.0,0.0,10154890600247217
He has grandchildren ? Does he not consider them close family ?,0.0,0.0,1.0,0.0,10154890600247217
Obama college buddy wants refugees?  lets send them there,0.0,0.0,1.0,0.0,10154890600247217
It shows how weak an American President is.,-0.293,0.293,0.707,0.0,10154890600247217
Justified ...,0.73,0.0,0.27,0.73,10154890600247217
Go judges! :),0.622,0.0,0.378,0.622,10154890600247217
"i don't understand? hundreds of kids are fighting cancer, what made this boy so special? because he was a football fan and a player took a liking to him? am i missing something? dont mean to sound rude, im just curious?",-0.04400000000000001,0.252,0.54,0.208,10154890480662217
"Football is placed falsely on higher level above other sports and games. There is nothing special about it. It is a sport that encourages wasting time and getting away from useful , more sane and liberating activities. Commercialization of the Sport and its forced advertising value is what is making it appear something fine.",0.033,0.126,0.715,0.159,10154890480662217
Heartbreaking. No parent should ever have to attend the funeral of their child. But please stop releasing balloons when someone dies. It serves no purpose and kills innocent wildlife,-0.225,0.367,0.491,0.142,10154890480662217
Opened the world's eyes to childhood cancer?! What utter nonsense. If the world claims it didn't know then it willfully chose to pretend to not see. This passing is incredibly sad but can we not fill it with hyperbole?,-0.141,0.141,0.859,0.0,10154890480662217
Heartbreaking...will forever be remembered for that beautiful beaming smile..his spirit his fight for life..im in tears every time i see this little sweethearts pictures..God bless you Bradley an inspiration to all of us..beautiful boy...thinking of all the family my heart goes out to you on losing this little treasure..❤❤❤❤❤😥😥😥,0.128,0.114,0.644,0.242,10154890480662217
"Rest in peace sweet boy. You will be missed but never forgotten due to your bravery and courage, and of course that super smile. Sleep tight little super star xx 💙💔
#onlyonebradleylowery 
#cancerhasnocolours",0.5,0.029,0.441,0.529,10154890480662217
"I feel doubly honoured to witness this, though in far away Nigeria, I echo the sounds of unity with everyone who took time to celebrate this wonderful kid. Rest on Bradley!",0.308,0.0,0.692,0.308,10154890480662217
"Bus drivers in Workington Cumbria are wearing their football tops for Bradley. 
Thinking of all little ones lost too soon 💙",0.05399999999999999,0.087,0.772,0.141,10154890480662217
Bradley Lowery Will always live in our nations hearts.God Bless. The Pride Of Britain xxx,0.12,0.14,0.6,0.26,10154890480662217
How lovely to see all the people there to pay tribute to such a special boy.  Living near London I couldn't line the street  but would wear my Spurs shirt.  So good to see supporters of different teams paying their respects.  Sending love and sympathy to Bradley's wonderful parents.,0.412,0.017,0.554,0.429,10154890480662217
R.I.P. Beautiful Bradley you brought love to us all with your Beautiful Smile & courage such a little fighter god bless you we will miss your your Beautiful smile always in our Hearts  ♥️ sleep 😴 tight Beautiful Angel 😇 xx💙💙💙💙💙💙,0.532,0.027,0.415,0.559,10154890480662217
"I love that fact all these people have come to say bye to this little boy no one can say they ain't cried at this 😭

And by the way Anthony ur a muppet",0.123,0.053,0.771,0.176,10154890480662217
Truly a lovely tribute for Bradley but please don't forget the children who are still fighting this illness that shows no mercy.,0.065,0.286,0.363,0.351,10154890480662217
"Nearly all workers around here are wearing football tops. Walked into Tescos at about 11.15 and their workers where standing in a half circle clapping for a min, I'm guessing it was for this brave little guy. Rip little guy. ❤",0.169,0.0,0.831,0.169,10154890480662217
I bet all the other little children dying of cancer feel really great that one child gets this amount of publicity.,0.0,0.164,0.672,0.164,10154890480662217
"good name is better than silver and gold; the crowds we are seeing today is a testament that the little angel we knew as Bradley, had penetrated the hearts of many with his unblemished smiles and determination to fight on till the end. RIP",0.172,0.05,0.728,0.222,10154890480662217
Goodbye Angel Bradley. You lived only for 6 years but left an example for millions how to live life despite miseries.enjoy a peaceful life in heaven now.,0.03299999999999999,0.111,0.745,0.144,10154890480662217
"WE cant let our NHS be privatised or this will happen a 1000 fold as the Americans own everything and the British Ruling Elites are happy to make it happen as they will also profit form having so much child death, child murder and exploitation on our shores.",-0.03899999999999999,0.152,0.735,0.113,10154890480662217
"Its nice to see people from all walks of life, football fan or otherwise gather to attend bradley's final sendoff. Bradley is a strong kid with a big heart. Blessed are the parents who's lucky enough to parent this kid for 6 years. Rest in heaven bradley, just look down and see how popular u have become.",0.315,0.0,0.685,0.315,10154890480662217
"So sad, rest in peace, little one, you made the most of your short life and touched so many with your smile",0.091,0.12,0.669,0.211,10154890480662217
Such a tiny coffin :( he's probably doing his big smiles down at us whilst we are all crying for him. Such a beautiful little angel :(,-0.05299999999999999,0.248,0.557,0.195,10154890480662217
"Awwwwww sad and really heart breaking,rest in peace little one and heaven'",0.18499999999999997,0.166,0.483,0.351,10154890480662217
Rest in peace little man from all of the Newcastle United fans!,0.397,0.0,0.603,0.397,10154890480662217
"I'm sure there's loads of fans for teams, actors, etc young and old who die from different things.",-0.072,0.176,0.721,0.104,10154890480662217
"Amazing to see how we show love for this wonderful soul.
R.I.P Lowery",0.379,0.119,0.383,0.498,10154890480662217
Hats off to Sunderland FC and all the people who attended his funeral... you are off to a better place now kiddo where u can play football all day!!!😇,0.198,0.0,0.802,0.198,10154890480662217
The crowd signified he brought great joy to many and earned respect in his brave fight against cancer. RIP,0.21599999999999997,0.203,0.378,0.419,10154890480662217
"You'll be the brightest star in the sky now Bradley , sleep tight little man 😘💙",0.222,0.0,0.778,0.222,10154890480662217
A star who will always shine bright 💙 god bless superman x,0.565,0.0,0.435,0.565,10154890480662217
"Rest In Peace young Bradley , will miss your smile  god bless you xxxx",0.454,0.078,0.39,0.532,10154890480662217
Bless you little man - you bought so much awareness to people. May you R.I.P forever with the Angels ❤️,0.135,0.0,0.865,0.135,10154890480662217
A life well lived even if it was too short. RIP little dude. In all our hearts as you made us all smile. Hero,0.291,0.0,0.709,0.291,10154890480662217
Rest in Peace wee man. Heartfelt sympathy to your family and friends.,0.612,0.0,0.388,0.612,10154890480662217
RIP Bradley... Keep smiling and playing football with the angels 😇 😇 😇 😇 xx,0.348,0.0,0.652,0.348,10154890480662217
"Fly high little dude, always be close to your family & shine brightly in the night sky God bless xx",0.316,0.0,0.684,0.316,10154890480662217
Bradley will always be in my heart specail little man xx,0.0,0.0,1.0,0.0,10154890480662217
"R.I.P Bradley Lowery, you fought the good battle and finished the race and you kept your faith",-0.07899999999999999,0.303,0.472,0.224,10154890480662217
What a beautiful send off for a very brave little boy. Condolences to the Family.,0.408,0.0,0.592,0.408,10154890480662217
RIP Bradley what a send off  the angels will look after you now.,0.0,0.0,1.0,0.0,10154890480662217
"Its not a matter of how long but how well, Sleep on in peace OUR LOVABLE BOY.",0.48000000000000004,0.038,0.444,0.518,10154890480662217
"Now you know, little chap, that underneath are the everlasting arms. RIP Bradley. My sympathy to his family.",0.128,0.0,0.872,0.128,10154890480662217
Bradley Lowery you are an angel you are free and can fly were your favourite team Sanderland go. Play you are in a good place now,0.17900000000000002,0.086,0.648,0.265,10154890480662217
Fly high Bradley R.I.P thinking of all your family and friends at this sad time xxx💙,0.0,0.153,0.693,0.153,10154890480662217
Rest In Peace Bradley Such A Brave Little One Love And   Thoughts To All Your Family Xxxxxx,0.454,0.0,0.546,0.454,10154890480662217
RIP little man sleep tight thoughts are with your family and friends and to each and every other family going thru similar circumstances 💙💙,0.119,0.0,0.881,0.119,10154890480662217
"Sending love and prayers for all the family. Bradley you will never be forgotten sweetheart, sleep well in the arms of the angels. <3 <3 <3",0.33799999999999997,0.088,0.486,0.426,10154890480662217
Rest in peace little fella. See you on the other side.  #BradleyLowery #ynwa,0.226,0.0,0.774,0.226,10154890480662217
"little bradley has touched so many hearts across the country, he has got a massive send off, R.I.P little man xx",0.0,0.0,1.0,0.0,10154890480662217
such a. beautiful lil boy he melts my heart. rest in peace sweet angel xx ❤️,0.444,0.0,0.556,0.444,10154890480662217
"Absolutely heartbreaking!! 😢
R.I.P Bradley 💙💙
My thoughts and love to his family and friends x x",0.208,0.148,0.496,0.356,10154890480662217
Some of the comments on here make my blood boil😡. RIP to a little boy that i have never met. Fly high with the angels Bradley 😘😘,0.0,0.0,1.0,0.0,10154890480662217
He's go more respect from fans that Theresa may...bless him xx,0.253,0.0,0.747,0.253,10154890480662217
Proud to be british as on days like today we unite. Thoughts with his family. X,0.301,0.0,0.699,0.301,10154890480662217
"Life wonderfully lived although a short time. 
RIP little one.
My condolences to the family.",0.231,0.0,0.769,0.231,10154890480662217
"God bless you little lad, lots of love to your parents and to your best football mate Jermaine Defoe  what a nice man xxxxx",0.472,0.0,0.528,0.472,10154890480662217
"Hope Sunderland get promoted for you little man, always in our hearts 💕",0.363,0.0,0.637,0.363,10154890480662217
"How can one forget his beautiful smile,R. I.P little man. Xxx",0.136,0.128,0.608,0.264,10154890480662217
"RIP brave little man, your fight touched so many hearts you will never be forgotten. Fly high & free x 💙😢",0.234,0.091,0.584,0.325,10154890480662217
"Rest in peace little Bradley, your friend Jermain is at our club Bournemouth now, we'll look after him for you xxxx",0.253,0.0,0.747,0.253,10154890480662217
