comment,compound,negative,neutral,positive,from_post_id
He's in heaven already but we will miss his cute face here,0.25,0.111,0.528,0.361,1426789250735491
💙rip little soldier xx,0.0,0.0,1.0,0.0,1426789250735491
Rip xx,0.0,0.0,1.0,0.0,1426789250735491
In the arms of the angels xx,0.0,0.0,1.0,0.0,1426789250735491
Heartbreaking r.I.p,-0.75,0.75,0.25,0.0,1426789250735491
God bless him.. His in a better place,0.661,0.0,0.339,0.661,1426789250735491
😢,0.0,0.0,0.0,0.0,1426789250735491
Bye buddy,0.0,0.0,1.0,0.0,1426789250735491
RIP little man 💙💙❤️💙💙,0.0,0.0,1.0,0.0,1426789250735491
Love you little man! RIP,0.529,0.0,0.471,0.529,1426789250735491
RIP very sad indeed xx,-0.459,0.459,0.541,0.0,1426789250735491
❤️ YNWA,0.0,0.0,1.0,0.0,1426789250735491
"Good bye Bradley , sleep sound 💕💕",0.367,0.0,0.633,0.367,1426789250735491
So sad rip little angel ❤️❤️xx,-0.404,0.404,0.596,0.0,1426789250735491
Rip you are among the special Angels above,0.278,0.0,0.722,0.278,1426789250735491
RIP little Bradley... inspiration to so many xx,0.308,0.0,0.692,0.308,1426789250735491
He was a loveley soul so many people came RIP little boy love u lots,0.246,0.0,0.754,0.246,1426789250735491
Heartbreaking and heartwarming all at the same time. RIP little one <3,0.154,0.169,0.508,0.323,1426789250735491
Sleep tight beautiful boy xx,0.494,0.0,0.506,0.494,1426789250735491
Little warrior god bless ❤️,0.592,0.0,0.408,0.592,1426789250735491
R I P little man fly with the angels x,0.0,0.0,1.0,0.0,1426789250735491
RIP Bradley fly high with the angels,0.0,0.0,1.0,0.0,1426789250735491
RIP little Bradley. 💕,0.0,0.0,1.0,0.0,1426789250735491
R. I. P. Little one.. 💙,0.0,0.0,1.0,0.0,1426789250735491
Sooo sad .made me cry how on earth do you deal with losing a child. R I P little man,-0.404,0.404,0.596,0.0,1426789250735491
Prayers,0.0,0.0,1.0,0.0,1426789250735491
"Rest In Peace little man
Good bye there is no pretty on this earth",0.331,0.102,0.465,0.433,1426789250735491
So sad love to you all ❤️❤️❤️❤️,0.08399999999999996,0.264,0.388,0.348,1426789250735491
"Great little man,rip.",0.672,0.0,0.328,0.672,1426789250735491
Go fly with the angels little man xxx🌟🌈😇❤️,0.0,0.0,1.0,0.0,1426789250735491
RIP. little Angel,0.0,0.0,1.0,0.0,1426789250735491
Rip Bradley,0.0,0.0,1.0,0.0,1426789250735491
RIP little man xxx,0.0,0.0,1.0,0.0,1426789250735491
So sorry,-0.614,0.614,0.386,0.0,1426789250735491
What a send off ❤️,0.0,0.0,1.0,0.0,1426789250735491
God Bless little man <3 x,0.79,0.0,0.21,0.79,1426789250735491
Tourists who have been to the beach have been sharing their experiences with us: http://www.bbc.co.uk/news/world-40597672,0.167,0.0,0.833,0.167,10154890645702217
The beach isn't in New Zealand it's in the Caribbean!,0.0,0.0,1.0,0.0,10154890645702217
Should put restriction n fenced up that areas from public to enter that place.,-0.149,0.149,0.851,0.0,10154890645702217
I can see a child's buggy!!! Put yourself in danger if you must but not your child. Morons!!!!,-0.183,0.183,0.817,0.0,10154890645702217
"They've changed it. 

Edit this... It's about as far away from New Zealand as you can get. The woman who died was from New Zealand. The airport is in the Caribbean.",-0.107,0.107,0.893,0.0,10154890645702217
I wouldn't want to be breathing in all those fumes.,-0.249,0.249,0.751,0.0,10154890645702217
"Yes, because just putting signs up telling people not do something will surely be enough to stop them doing it? How about fencing it off or filling the area with large rocks or something to prevent people accessing the area.",0.09999999999999999,0.049,0.802,0.149,10154890645702217
"UMMMMMM I am pretty sure the woman that passed away was from New Zealand, and this is in Saint Maarten. Your post and your video are conflicting.",0.089,0.087,0.737,0.176,10154890645702217
"The island could have taken away the concrete barriers to make this a heck of a lot safer. I'm guessing they will stop tourists from doing this. But, hey, it's an island find something else to do.",0.008,0.044,0.904,0.052,10154890645702217
"Reading these comments I have no faith left in humanity...yes it was dangerous but she wasn't the first ever person to do it, millions have and will continue to. Gayle was a lovely, normal person who was simply unlucky when doing something dangerous. Her husband and two girls are now left without a mother. Have some heart.",-0.010999999999999996,0.122,0.767,0.111,10154890645702217
Nature has a way of thinning the stupid from the herd. These are the same sort that would stand on the beach and watch a giant tsunami heading toward them...,-0.112,0.112,0.888,0.0,10154890645702217
"It's Sint Maarten, not New Zeland. Whose writing this stuff??",0.0,0.0,1.0,0.0,10154890645702217
"Come on BBC, get your facts right. This airport is in St Maartens in the Caribbean, nowhere near New Zealand. Dreadful reporting by a failing news organisation.",-0.205,0.205,0.795,0.0,10154890645702217
When do s Personal Responsibility come into the equation?  There is a sign. Common sense tells you this is dangerous and now they blame the authorities.  Stupid people will always do stupid things,-0.313,0.313,0.687,0.0,10154890645702217
What are these idiots thinking? I saw children and even a pushchair in this clip! Irresponsible and totally selfish. If you want to risk your life go ahead but don't drag your own kids into doing such stupid activities just for your thrill!😡,-0.158,0.222,0.714,0.064,10154890645702217
"The woman who died was from New Zealand. The airport is, as others have stated in Sint Maarten which is in the Caribbean.  Wouldn't care, but BBC News already reported on this with the correct details.  BBC News, get a proof-checker!",-0.104,0.104,0.896,0.0,10154890645702217
"it had to be the melanin deprived race, just last week one dare devil died from a high fall, this jet blasting killed a woman and a shark ate a man in a purple speedo, when will it end",-0.342,0.342,0.658,0.0,10154890645702217
I'm pretty sure this beach is nowhere near a New Zealand airport.  It's kind of on the opposite side of the planet from NZ.  The dead woman was from NZ though.,0.03199999999999999,0.117,0.734,0.149,10154890645702217
"Jeez, how did this get published?  New Zealand near the Caribbean?  On another note,  I lived on St Maarten for two years and  am saddened by this incident. Maybe they will have to put a stop to people jet surfing, shame 😢",-0.201,0.201,0.799,0.0,10154890645702217
"Darwin Award candidates ~ every single one of them! Morons.

Why don't the authorities close andmake inaccessible, the section of the beach that is beneath flight paths, or behind where jets prepare to take off??? Problem solved. It's not rocket science. No joke intended.",0.10500000000000001,0.095,0.704,0.2,10154890645702217
"Pretty sure its not near a NZ beach unless you consider 8K miles to be close...This occurred at St. Maarten, in the Caribbean!  There is a perfectly nice bar close by where you can sit and view planes and not get hurt!",0.312,0.0,0.688,0.312,10154890645702217
"The signage has been willfully negligent by ommission.  ""Danger"" is not enough.  ""Risk of Serious Injury or Death"" is appropriate.  So what's the difference?  People are used to seeing signage in places that probably have a very low risk factor -- automatic garage doors for example.  How many people are seriously injured or KILLED?  So it has become a warning taken tongue-in-cheek by most people.  On the other hand, drivers rushing to cross a railroad track as a train approaches is a counter example of high risk takers.  In this case, it has become sort of a ""tourist site"" to see a congregation of people at the St. Maartin airport.  How long has this been going on?  The government and airport authorities MUST be aware of it.  So, seriously, they can not hire a guard to command people to leave that area?  or to build a larger barricade such as made of solid concrete to deflect the air flow upward?  In fact, the authorities have accepted and therefore encouraged the practice of people coming up to the fence on a regular and constant basis.  This should make the authorities even more at fault than the tourists who probably did not think there is an actual risk of death.  Now, how will their legal system handle this?",-0.11600000000000002,0.169,0.777,0.053,10154890645702217
My understanding was that this is a Caribbean beach and that the accidentally killed person was NZ passport holder.....BBC...any thoughts??,-0.299,0.299,0.701,0.0,10154890645702217
I'd say it's about ten thousand miles from a New Zealand airport. But anyway.,0.0,0.0,1.0,0.0,10154890645702217
"Fence and adequate signage is there.Those tourist who continue to disobey these danger signs must be illiterate or retarded.
Soon some idiot will be blaming this country's authorities when they have done their due diligence n erect appropriate danger signs.What a crap.Ppl get your THRILLS elsewhere.",-0.19999999999999998,0.287,0.626,0.087,10154890645702217
Uma Sepsi yay more stupid people!!!!!!!!!!!!!!!!!!!!!!!!!!!!!!!!!!!!!!!!!,-0.119,0.396,0.326,0.277,10154890645702217
"St. Martin needs to close this beach to protect idiots from themselves.

On another note, no where in this does it say that New Zealand is or near the Caribbean (as some of the other commenters have suggested)... It, in fact, states: ""A New Zealand woman has died doing this on the Caribbean territory of Sint Martin.""",-0.051,0.093,0.865,0.042,10154890645702217
"there should be a £2000 fine or 6 months in prison for ignoring the sign  do this a few dozen times and people will get the drift  otherwise put a sign up do this at your own risk,,,if you get injured doing this then you should pay all medical bills out of your own pocket including the ambulance ride to hospital,,,if your killed then your family should shoulder the cost of getting your thick stupid body back home ,,,,,,,,,,come on guys you know a jet plane blast can throw a car in the air what makes you think your heavier than a car ,,,and why would you let kids do this if they did something wrong at home you would go down their throats for being silly ,,,,,,come on everyone enjoy your holiday but don't be bloody stupid to not come home alive",-0.07800000000000001,0.14,0.798,0.062,10154890645702217
"I would've thought anyone with half a brain cell might realise the consequences of standing behind an aircraft, limited sympathy for anyone that suffers as a result of it really",-0.08,0.159,0.762,0.079,10154890645702217
"There is fence but some idiots climb it, the only solution is to close the beach.

Human life come first.",0.134,0.0,0.866,0.134,10154890645702217
"If there are warnings but people elect to do it anyway, so be it. Nothing in life is without risk. Shark diving in a cage, skydiving, even flying itself. No one is to blame. Sometimes, things just go wrong. Personally, I'd love to have the experience of being ""jet-blasted"" on that beach.",-0.07700000000000001,0.2,0.677,0.123,10154890645702217
"And the Darwin Award goes to... 

If authorities see that this dangerous blast-chasing thing happens everyday despite warning signs, they should just close that beach to public access,simple as that. But it attracts tourists, therefore, money. That beach is famous because of this. My point being: No one cares about anything.",0.10099999999999999,0.083,0.733,0.184,10154890645702217
"It's not near a New Zealand beach, the woman who died is from New Zealand. Even I know this.  Where are you finding your writers these days?",-0.13,0.13,0.87,0.0,10154890645702217
"New Zealand? Bravo BBC researchers, but this is St. Maarten in the Caribbean!",0.0,0.0,1.0,0.0,10154890645702217
"This is Darwinism at its finest.  It is sad that such an accident occurred, but it was her fault for putting her own life at risk.  That is what happens when you do risky things, but people never take responsibility or place the blame on the person who made the mistake they always have to place the blame on somebody else.  Grow up, be an adult, and take responsibility for your actions.",-0.254,0.254,0.746,0.0,10154890645702217
"Have these thrill seekers no thoughts for their children, in the middle of a jet blast, smoke pollution.
Why some people bother having children beats me when they put them in danger. It actually killed one lady.",-0.21800000000000003,0.272,0.674,0.054,10154890645702217
"when you go to another country or place..do heed to the rules and laws. the authorities have put up signs and warnings but why..for the sake of ""thrill"", would you refuse to adhere to those signboards? i see there even kids there..is life so cheap nowadays?",-0.1,0.1,0.9,0.0,10154890645702217
"Lads and lasses, this is one of those times where we have to just let nature take its course. Can't keep putting warnings on everything, it'll exhaust our resources as a species",-0.009000000000000001,0.066,0.876,0.057,10154890645702217
"It's called thinning the herd, let them do it. If you see the sign pointing out the danger and do it anyway, you kinda have it coming to you.",-0.108,0.108,0.892,0.0,10154890645702217
I grew up in a small city where the runway of the airport was near a loop in a main road. So getting stuck in traffic always meant having planes flying overhead. I guess it wasn't a big deal because of the size limit on the planes and due to the air currents and drafts the time where planes flew in and out was also limited to specific windows.,-0.064,0.064,0.936,0.0,10154890645702217
"Murphy v Steeplechase Amusement (1929) a person assumes the risk of injury when the danger of the sport is inherently obvious. If you choose to ride an attraction called ""The Flopper,"" you can reasonably expect you will flop. However, this is US law...",-0.102,0.209,0.684,0.107,10154890645702217
"I've been here. Strange, I don't remember people wanting to do this 15+ years ago. There was just a big patch of open sand because the planes would blow your towels into the ocean.",-0.055,0.055,0.945,0.0,10154890645702217
"Ummmmmm the lady was from New Zealand

Therefore proof that the BBC news is continually sharing fake news

It's a conspiracy I say!!!!!",-0.171,0.269,0.632,0.098,10154890645702217
"A parent had a child young enough to go in a buggy there. What the hell! 
If you want to be an idiot and risk your life doing this then by all means. But don't subject your children to it.",-0.138,0.166,0.806,0.028,10154890645702217
"Instead of fighting human nature, they should make it safer assuming people would do this.

If the concrete can go, they should remove it.

Let people have fun, knowing the risks.",0.04000000000000001,0.122,0.716,0.162,10154890645702217
"New Zealand woman? What was her ethnic origin, ideology of choice, & colour?",0.0,0.0,1.0,0.0,10154890645702217
It's not the jet engine blast that killed this poor woman it's the concrete blocks they've put their! Otherwise she would have just flown down in the sand! With that beach and road being open to the public it's hard to stop this attraction.,-0.192,0.255,0.682,0.063,10154890645702217
"There was a clear warning sign, and this person chose to take a risk regardless. It was quite a stupid decision to climb the fence, but even this is probably a common activity that generally never results in death. More of a freak accident than a definite way for someone to die. At the very most, the only changes that should be made by the airport / authorities would be to the fence design, making it more difficult for people to climb up. Barricading the area off completely and banning people from the area would be comparable to fencing off a scenic mountain path that hundreds of people like to climb and enjoy safely, but which does produce the occasional fatality when people slip. Just because this area carries a (clearly communicated) risk shouldn't be a reason for the authorities to step in and make adjustments. People take risks and are responsible for their own safety in areas like this. One fatality is a tiny drop in the bucket compared to the hundreds of people doing this each month without incident.",-0.061,0.197,0.667,0.136,10154890645702217
Oh where di you go for your Holiday - I completly lost my mind and booked week on a flight path - No tan But the sand blasting got me realy clean.,0.065,0.1,0.735,0.165,10154890645702217
"Who the heck is ""They""?  What about ""I"" and /or  ""We"" decided to do something stupid today ? We don't know what it was, or where we were.",-0.126,0.126,0.874,0.0,10154890645702217
"When you hoped to rid the planet of stupidity but they decided to do it themselves. Walking into a danger zone like you are invulnerable, not cool.",-0.026999999999999996,0.243,0.541,0.216,10154890645702217
"Its been corrected now.

Just how close to New Zealand is this airport?",0.0,0.0,1.0,0.0,10154890645702217
not being harsh here but there's warning signs there for a reason so if anyone gets hurts or even killed it's there fault and want winds me up more children are also there!!,-0.31,0.377,0.556,0.067,10154890645702217
Saurav Hoina kasto achamma ko huncha hai manche haru uniharu lai ta tornado nai kafi chaina ke k ho 😪😪,0.0,0.0,1.0,0.0,10154890645702217
"The video is correct on location, but your lead-in comment is not.
And why in the hell are people taking small children in strollers to this location???!!!!",-0.238,0.238,0.762,0.0,10154890645702217
"the signs are up to warn people, they have a choice to do it! let them carry on, i wonder if there holiday insurance is valid if anything happens?",0.05399999999999999,0.048,0.851,0.102,10154890645702217
It's one thing for an adult to stand there for the experience but in that clip there was an adult holding a child with a pram nearby !!!!!!,0.0,0.0,1.0,0.0,10154890645702217
Elliot Duby I was there last year and it was terrifying when the planes took off,-0.209,0.209,0.791,0.0,10154890645702217
"She was 50 and was standing on something. Then fell. Not a smart move. Most people are young and vital. Also, they stand on solid GROUND!",0.06399999999999999,0.08,0.776,0.144,10154890645702217
"Without Protective Goggles for sand blasting, this is totally crazy  http://www.eastwood.com/safety-goggles.html",-0.212,0.212,0.788,0.0,10154890645702217
Omg why the hell would you take your kid there?? Hope the wee baby ok and should be rules against kids being allowed there to,0.027000000000000024,0.143,0.686,0.17,10154890645702217
"Having been there and experienced this, it is really fun.  Even though it's dangerous and people shouldn't be doing it, it's human nature!",0.02800000000000001,0.111,0.75,0.139,10154890645702217
"I think that any parent putting there child in such great risk should be investigated by the authorities, absolutely disgusting,",-0.066,0.224,0.618,0.158,10154890645702217
"Wouldn't go anywhere near that place. I'd be terrified, not to mention deafened, every time a plane came in. Thought it was a joke or photoshopped when I first heard about this place a few months ago. I just don't get how it can even be allowed to happen ..planes getting so close to people.",-0.032999999999999995,0.074,0.886,0.041,10154890645702217
Only a matter of time    before some on died         must admit   i thought it would be from the heat of the engins,-0.03,0.153,0.723,0.123,10154890645702217
"I just wonder.....WHY & HOW did humanit became so STUPID......WHAT DID HAPPEN to our brains..........Is it a cultural inbreeding, or foods/water/chemicals, or all together............????????????",0.0,0.0,1.0,0.0,10154890645702217
This just looks so dumb. Like really people. You go to a tropical destination and you want to hang out getting a wind from jets? What a waste.,-0.092,0.219,0.654,0.127,10154890645702217
"You want to live on the edge, then sometimes you die on the edge.  Personal choice and no one else has culpability.",-0.182,0.231,0.72,0.049,10154890645702217
Is the BBC being run by the The Sun...? The Sun ran this today - it's old news about the woman being killed! Struggling for drama today are we?,-0.234,0.234,0.766,0.0,10154890645702217
Idiots on the beach holding on to the fences when it clearly says not to do so + jet engine blasts = ☠️,0.119,0.0,0.881,0.119,10154890645702217
"yes, let's say, if the want to do it, do it on their own risk. Fair enough. But one of the guy was holding a child, and that is just not ok. At all.",0.021000000000000005,0.106,0.766,0.127,10154890645702217
"It's obviously very sad, but there are signs and fences so if people are determined to get their photo or video they know the risks.",-0.05800000000000001,0.162,0.735,0.104,10154890645702217
I can't believe these idiots would endanger the lives of their children. I saw a young girl and I also saw a stroller. WTF???,-0.22,0.22,0.78,0.0,10154890645702217
People say it's a tourist attraction 🙄 there are a lot more tourist attractions on the island that won't get you killed. Maybe they should electrify the fence.,0.305,0.0,0.695,0.305,10154890645702217
"Crazy, people are there with their children...choosing to put their children in danger...there's a stroller!  A child small enough for a stroller!  SMH!!",-0.268,0.268,0.732,0.0,10154890645702217
"Not heard Thrill seekers going there but, it's a  a planespotters dream to go there! Would love to go there but stand on the beach 🌊",0.23299999999999998,0.052,0.663,0.285,10154890645702217
"Most people go there fir the thrill of seeing the planes and the blast on take off, the lady who died unfortunately knew the consequences.",-0.115,0.197,0.721,0.082,10154890645702217
They don't discourage it.  They bus people in.  Been there and that was one tour I didn't take.  Better hope a plan doesn't crash.,-0.00799999999999998,0.176,0.657,0.168,10154890645702217
"If I am the pilot, that's a high pressure landing with the crowd right below. Imagine u drive into the garage and your son sit meters in front!",-0.094,0.094,0.906,0.0,10154890645702217
£145 for this! Regressive tax paid by the poor when you should get your guardian upper middle class cronies to pay for it pal!,-0.188,0.188,0.812,0.0,10154890645702217
Hello BBC if you going to do a report on a country get the name correct. It is  Sint Maarten Not New Zealand,0.0,0.0,1.0,0.0,10154890645702217
Shane Borges bruh where is this beach 🤣 let's do this!,0.0,0.0,1.0,0.0,10154890645702217
"""For God so loved the world, that he gave his only begotten son, that whosoever believeth in him should not perish, but have everlasting life."" John 3:16",0.154,0.0,0.846,0.154,10154890645702217
Sint Maarten is on the other side of the world from New Zealand.,0.0,0.0,1.0,0.0,10154890645702217
Last time I checked Sint Maarten was nowhere near New Zealand,0.0,0.0,1.0,0.0,10154890645702217
BBC News the beach is in the caribbean and not in New Zealand! Please stop spreading fake news! haha,-0.022999999999999993,0.225,0.573,0.202,10154890645702217
It's in Sint Maarten. It's in the Caribbean. Nowhere near any New Zealand airport.,0.0,0.0,1.0,0.0,10154890645702217
Macho Beach!!! They enjoy craziness there! That is why easy to remember the 'geographical 'name of that 'beach 🎆!!!,0.18000000000000002,0.101,0.619,0.281,10154890645702217
BBC News  this beach near a New Zealand airport !...ERR...no it isn't!,0.0,0.0,1.0,0.0,10154890645702217
"Since when Sint Maarten is in New Zealand? Gosh, fix it because eyes are burning from looking at it...",0.0,0.0,1.0,0.0,10154890645702217
"Why would anyone in their right mind believe that this is a safe or wise thing to do. Stupid is, as stupid does",-0.025999999999999995,0.221,0.584,0.195,10154890645702217
Tom Puiatti lets go jet blasting,0.0,0.0,1.0,0.0,10154890645702217
"I wouldn't want hot air, chemicals and feums from that jet blowing on me anyway",-0.086,0.086,0.914,0.0,10154890645702217
#JusticeForChelsey. I will comment this until you report this incident.,0.0,0.0,1.0,0.0,10154890645702217
Every single person making the choice to do this deserves a Darren award.....as for those brings their kids.....😡,0.0,0.0,1.0,0.0,10154890645702217
Sam Wild me and Samantha Oxley have been to this beach!! Do you remember we sat in that little bar Sam?! Amazing! X,0.183,0.0,0.817,0.183,10154890645702217
Headline wrong!! This isn't New Zealand?????,-0.482,0.482,0.518,0.0,10154890645702217
"Yes yes, people... We get it....they they mislabeled where the airport is... Don't need a thousand posts pointing it out",0.241,0.0,0.759,0.241,10154890645702217
"Oh jeez - it's in the Caribbean, the other side of the world to New Zealand. Pahahahaha!!!",0.0,0.0,1.0,0.0,10154890645702217
Why would you put an airport next to a beach,0.0,0.0,1.0,0.0,10154890645702217
"Trump is doing his job to turn america in a safe place.

When the attacks begin, blame those socalled Judges.",-0.099,0.219,0.661,0.12,10154890600247217
Can't we just ban Trump? It would save so much hassle. 🙄,0.405,0.0,0.595,0.405,10154890600247217
Hawaii is an Obama stronghold. They think Unicorns actually exist.,0.143,0.0,0.857,0.143,10154890600247217
Trump could cure cancer and people would be upset. This is a month old bit of information. How many times will you report it from different angles for click bait and to sow disention?,-0.184,0.184,0.816,0.0,10154890600247217
"Well,Hawaii, you can kiss my tourist money goodbye. Good luck when the illegals start assaulting and murdering your citizens. Don't come crying for help. You brought this on yourselves",0.14600000000000002,0.174,0.505,0.32,10154890600247217
Judges r human being without realizing what Trump imposed ban on certain muslim country due to ISIS is for the good of US. Should anything happen in US just like the New York towers blown by the aircraft in years 2000. Who is going to be responsibled should such incident happen again.,0.044,0.084,0.788,0.128,10154890600247217
